{
  "meta": {
    "generated": "2026-10-22T04:18:34Z",
    "hardware": "Linux x86_64, 13th Gen Intel Core i5-13500, 20 logical CPUs; Rust programs run under `taskset -c 0-3` (performance-core threads); Python scripts not pinned",
    "toolchain": "rustc 1.97.1",
    "compiler_flags": "--release (opt-level=3, codegen-units=16)",
    "benchmark_commit": "951c493",
    "crate_versions": {
      "harpe": "0.1.0-alpha.6",
      "kibisis": "0.1.0-alpha.9",
      "argus-ledger": "0.1.0-alpha.5"
    },
    "note": "Each claim value is read from one run of make bench (timestamp_utc in each report). make bench neither repeats runs nor waits for a quiet machine. The published figures on telarch.ai/evidence are medians of repeated runs, with every run listed."
  },
  "claims": {
    "harpe_small_p50_us": {
      "id": "harpe_small_p50_us",
      "statement": "Harpe selects and packs 10 context items within budget at microsecond median latency",
      "value": 1.66,
      "unit": "\u00b5s",
      "scope": "10 context items, 60-token ceiling, single process, median of 2,000 calls",
      "dataset": "Synthetic context items generated by the program",
      "hardware": "Linux x86_64, 13th Gen Intel Core i5-13500, 20 logical CPUs; Rust programs run under `taskset -c 0-3` (performance-core threads); Python scripts not pinned",
      "toolchain": "rustc 1.97.1",
      "commit": "951c493",
      "crate_versions": {
        "harpe": "0.1.0-alpha.6",
        "kibisis": "0.1.0-alpha.9",
        "argus-ledger": "0.1.0-alpha.5"
      },
      "run_count": 1,
      "median": null,
      "range": null,
      "raw_data_path": "reports/microbenchmarks_phase1.json",
      "method_link": "https://github.com/Perseus-Computing-LLC/telarch-benchmarks/blob/951c4936d0529dcc2b8e83d53bdf4d823fb311e0/telarch-benchmarks/src/main.rs",
      "limits": "In-memory, single-threaded, synthetic context items",
      "status": "measured",
      "note": ""
    },
    "harpe_large_p50_us": {
      "id": "harpe_large_p50_us",
      "statement": "Harpe selects and packs 200 context items within a 1,500-token budget: median latency",
      "value": 33.322,
      "unit": "\u00b5s",
      "scope": "200 context items, 1,500-token ceiling, single process, median of 500 calls",
      "dataset": "Synthetic context items generated by the program",
      "hardware": "Linux x86_64, 13th Gen Intel Core i5-13500, 20 logical CPUs; Rust programs run under `taskset -c 0-3` (performance-core threads); Python scripts not pinned",
      "toolchain": "rustc 1.97.1",
      "commit": "951c493",
      "crate_versions": {
        "harpe": "0.1.0-alpha.6",
        "kibisis": "0.1.0-alpha.9",
        "argus-ledger": "0.1.0-alpha.5"
      },
      "run_count": 1,
      "median": null,
      "range": null,
      "raw_data_path": "reports/microbenchmarks_phase1.json",
      "method_link": "https://github.com/Perseus-Computing-LLC/telarch-benchmarks/blob/951c4936d0529dcc2b8e83d53bdf4d823fb311e0/telarch-benchmarks/src/main.rs",
      "limits": "In-memory, single-threaded, synthetic context items",
      "status": "measured",
      "note": ""
    },
    "harpe_large_reduction_pct": {
      "id": "harpe_large_reduction_pct",
      "statement": "Context reduction ratio for 200-item scenario enforcing a 1,500-token ceiling",
      "value": 69.51,
      "unit": "%",
      "scope": "200 context items, 1,500-token ceiling",
      "dataset": "Synthetic context items generated by the program",
      "hardware": "Linux x86_64, 13th Gen Intel Core i5-13500, 20 logical CPUs; Rust programs run under `taskset -c 0-3` (performance-core threads); Python scripts not pinned",
      "toolchain": "rustc 1.97.1",
      "commit": "951c493",
      "crate_versions": {
        "harpe": "0.1.0-alpha.6",
        "kibisis": "0.1.0-alpha.9",
        "argus-ledger": "0.1.0-alpha.5"
      },
      "run_count": 1,
      "median": null,
      "range": null,
      "raw_data_path": "reports/microbenchmarks_phase1.json",
      "method_link": "https://github.com/Perseus-Computing-LLC/telarch-benchmarks/blob/951c4936d0529dcc2b8e83d53bdf4d823fb311e0/telarch-benchmarks/src/main.rs",
      "limits": "Fixed synthetic haystack; reduction depends on input token distribution",
      "status": "measured",
      "note": ""
    },
    "harpe_curve_turns": {
      "id": "harpe_curve_turns",
      "statement": "Simulated autonomous agent invocation turns executed under continuous budget enforcement",
      "value": 100000,
      "unit": "turns",
      "scope": "100,000 simulated agent turns, 1,200-token ceiling",
      "dataset": "Synthetic multi-turn agent trajectory with pinned system items and variable context items",
      "hardware": "Linux x86_64, 13th Gen Intel Core i5-13500, 20 logical CPUs; Rust programs run under `taskset -c 0-3` (performance-core threads); Python scripts not pinned",
      "toolchain": "rustc 1.97.1",
      "commit": "951c493",
      "crate_versions": {
        "harpe": "0.1.0-alpha.6",
        "kibisis": "0.1.0-alpha.9",
        "argus-ledger": "0.1.0-alpha.5"
      },
      "run_count": 1,
      "median": null,
      "range": null,
      "raw_data_path": "reports/step1_knapsack_cost_curve.json",
      "method_link": "https://github.com/Perseus-Computing-LLC/telarch-benchmarks/blob/951c4936d0529dcc2b8e83d53bdf4d823fb311e0/telarch-benchmarks/src/bin/knapsack_cost_curve.rs",
      "limits": "Simulated agent context trajectory, in-memory heuristic token estimation",
      "status": "measured",
      "note": ""
    },
    "harpe_curve_reduction_pct": {
      "id": "harpe_curve_reduction_pct",
      "statement": "Tokens removed over 100,000 simulated turns relative to unbudgeted accumulation",
      "value": 78.29,
      "unit": "%",
      "scope": "100,000 synthetic turns, 1,200-token ceiling",
      "dataset": "Synthetic agent trajectory (520.6M raw tokens vs 113.0M synthesized tokens)",
      "hardware": "Linux x86_64, 13th Gen Intel Core i5-13500, 20 logical CPUs; Rust programs run under `taskset -c 0-3` (performance-core threads); Python scripts not pinned",
      "toolchain": "rustc 1.97.1",
      "commit": "951c493",
      "crate_versions": {
        "harpe": "0.1.0-alpha.6",
        "kibisis": "0.1.0-alpha.9",
        "argus-ledger": "0.1.0-alpha.5"
      },
      "run_count": 1,
      "median": null,
      "range": null,
      "raw_data_path": "reports/step1_knapsack_cost_curve.json",
      "method_link": "https://github.com/Perseus-Computing-LLC/telarch-benchmarks/blob/951c4936d0529dcc2b8e83d53bdf4d823fb311e0/telarch-benchmarks/src/bin/knapsack_cost_curve.rs",
      "limits": "Baseline is unbudgeted accumulation of the same items; financial savings depend on model pricing",
      "status": "measured",
      "note": ""
    },
    "harpe_curve_overruns": {
      "id": "harpe_curve_overruns",
      "statement": "Count of simulated agent turns that exceeded the designated 1,200-token ceiling",
      "value": 0,
      "unit": "turns",
      "scope": "100,000 simulated turns, 1,200-token ceiling",
      "dataset": "Synthetic agent trajectory",
      "hardware": "Linux x86_64, 13th Gen Intel Core i5-13500, 20 logical CPUs; Rust programs run under `taskset -c 0-3` (performance-core threads); Python scripts not pinned",
      "toolchain": "rustc 1.97.1",
      "commit": "951c493",
      "crate_versions": {
        "harpe": "0.1.0-alpha.6",
        "kibisis": "0.1.0-alpha.9",
        "argus-ledger": "0.1.0-alpha.5"
      },
      "run_count": 1,
      "median": null,
      "range": null,
      "raw_data_path": "reports/step1_knapsack_cost_curve.json",
      "method_link": "https://github.com/Perseus-Computing-LLC/telarch-benchmarks/blob/951c4936d0529dcc2b8e83d53bdf4d823fb311e0/telarch-benchmarks/src/bin/knapsack_cost_curve.rs",
      "limits": "Strict knapsack invariant holds assuming token counter matches downstream tokenizer",
      "status": "measured",
      "note": ""
    },
    "harpe_curve_avg_us": {
      "id": "harpe_curve_avg_us",
      "statement": "Average Harpe context selection latency per turn over 100,000 turns",
      "value": 46.16,
      "unit": "\u00b5s",
      "scope": "100,000 synthetic turns, 1,200-token ceiling",
      "dataset": "Synthetic agent trajectory",
      "hardware": "Linux x86_64, 13th Gen Intel Core i5-13500, 20 logical CPUs; Rust programs run under `taskset -c 0-3` (performance-core threads); Python scripts not pinned",
      "toolchain": "rustc 1.97.1",
      "commit": "951c493",
      "crate_versions": {
        "harpe": "0.1.0-alpha.6",
        "kibisis": "0.1.0-alpha.9",
        "argus-ledger": "0.1.0-alpha.5"
      },
      "run_count": 1,
      "median": null,
      "range": null,
      "raw_data_path": "reports/step1_knapsack_cost_curve.json",
      "method_link": "https://github.com/Perseus-Computing-LLC/telarch-benchmarks/blob/951c4936d0529dcc2b8e83d53bdf4d823fb311e0/telarch-benchmarks/src/bin/knapsack_cost_curve.rs",
      "limits": "Single process; CPU pinning as stated under hardware",
      "status": "measured",
      "note": ""
    },
    "kib_lease16_ops": {
      "id": "kib_lease16_ops",
      "statement": "Lease operations per second under high contention with 16 competing workers",
      "value": 2068394,
      "unit": "ops/s",
      "scope": "16 worker threads, one contended resource, in-process coordinator",
      "dataset": "32,000 contention cycles, 50 ms requested lease TTL",
      "hardware": "Linux x86_64, 13th Gen Intel Core i5-13500, 20 logical CPUs; Rust programs run under `taskset -c 0-3` (performance-core threads); Python scripts not pinned",
      "toolchain": "rustc 1.97.1",
      "commit": "951c493",
      "crate_versions": {
        "harpe": "0.1.0-alpha.6",
        "kibisis": "0.1.0-alpha.9",
        "argus-ledger": "0.1.0-alpha.5"
      },
      "run_count": 1,
      "median": null,
      "range": null,
      "raw_data_path": "reports/step2_adversarial_contention.json",